{
  "version": "1.0",
  "suiteId": "example-login-suite",
  "source": {
    "format": "xlsx",
    "fileName": "测试用例模板.xlsx",
    "sheetName": "测试用例",
    "sha256": "0000000000000000000000000000000000000000000000000000000000000000"
  },
  "target": {
    "baseUrl": "https://example.test/",
    "allowedOrigins": [
      "https://example.test/"
    ],
    "authProfile": "admin"
  },
  "policy": {
    "caseTimeoutMs": 60000,
    "retries": 1,
    "repair": {
      "maxAttempts": 2,
      "allowedChanges": [
        "locator",
        "waitCondition"
      ],
      "assertionMutation": "forbidden"
    },
    "destructiveActions": "blocked"
  },
  "cases": [
    {
      "id": "login-001",
      "title": "正确账号密码登录成功",
      "modulePath": [
        "登录"
      ],
      "priority": "P0",
      "risk": "read",
      "tags": [
        "smoke",
        "login"
      ],
      "dependencies": [],
      "preconditions": [
        "登录页面可以访问"
      ],
      "dataBindings": [
        {
          "name": "username",
          "source": "secret",
          "secretRef": "admin.username"
        },
        {
          "name": "password",
          "source": "secret",
          "secretRef": "admin.password"
        }
      ],
      "steps": [
        {
          "id": "step-1",
          "action": "navigate",
          "targetDescription": "登录页面",
          "literalValue": "/login",
          "sourceText": "打开登录页面",
          "confidence": 1
        },
        {
          "id": "step-2",
          "action": "fill",
          "targetDescription": "用户名输入框",
          "locator": {
            "strategy": "label",
            "value": "用户名",
            "source": "playwrightCli"
          },
          "valueRef": "username",
          "sourceText": "输入正确用户名",
          "confidence": 0.98
        },
        {
          "id": "step-3",
          "action": "fill",
          "targetDescription": "密码输入框",
          "locator": {
            "strategy": "label",
            "value": "密码",
            "source": "playwrightCli"
          },
          "valueRef": "password",
          "sourceText": "输入正确密码",
          "confidence": 0.98
        },
        {
          "id": "step-4",
          "action": "click",
          "targetDescription": "登录按钮",
          "locator": {
            "strategy": "role",
            "value": "button",
            "name": "登录",
            "exact": true,
            "source": "playwrightCli"
          },
          "waitFor": {
            "kind": "url",
            "expected": "/dashboard",
            "timeoutMs": 10000
          },
          "sourceText": "点击登录按钮",
          "confidence": 0.99
        }
      ],
      "assertions": [
        {
          "id": "assert-1",
          "kind": "url",
          "operator": "contains",
          "expected": "/dashboard",
          "sourceText": "跳转到系统首页",
          "oracleSource": "tester",
          "immutable": true,
          "confidence": 1
        }
      ],
      "cleanupSteps": [],
      "review": {
        "status": "draft",
        "ambiguities": [],
        "confidence": 0.98
      },
      "sourceRow": 2
    }
  ]
}
